,artist_name,track_name,release_date,genre,lyrics,len,dating,violence,world/life,night/time,shake the audience,family/gospel,romantic,communication,obscene,music,movement/places,light/visual perceptions,family/spiritual,like/girls,sadness,feelings,danceability,loudness,acousticness,instrumentalness,valence,energy,topic,age
38986,zac brown band,cover me up,2017,country,want milk want filthy money go wanna time dime money maker gonna bind break money maker keep guess tell money maker gonna bind break money maker,26,0.002506266,0.002506266,0.002506266,0.002506266,0.002506266,0.002506266,0.002506266,0.002506266,0.345078228,0.002506266,0.209388441,0.002506266,0.002506266,0.002506266,0.156459933,0.002506266,0.433553558,0.657308412,0.719879237,0,0.135408079,0.237213414,obscene,0.042857143
38989,brad paisley,today,2017,country,sit traffic afternoon bore death wait room gonna close eye picture today brush hair eye keep fall feel like luckiest alive today know tomorrow right world feel right memory like today rest life know like life change quick kiss miss today know tomorrow right world right memory like today rest life season change time go hair grey know sure gonna beautiful today bring tomorrow today bring tomorrow today bring tomorrow right world right bring tomorrow memory like today rest life,80,0.000711238,0.027910739,0.520500667,0.11530574,0.000711238,0.000711238,0.000711238,0.000711238,0.000711238,0.000711238,0.000711238,0.000711238,0.000711238,0.182926071,0.066635548,0.049045794,0.309000325,0.734789632,0.541164198,0.002287449,0.269373454,0.632621159,world/life,0.042857143
38219,mbest11x,bitch i operate,2016,country,seat motherfucker bout blow mind haha fuck crazy drink sippin whiskey come ridin dirty word face bitch operate mornin feelin kinda fresh pound bacon motherfuckin chest carbon stain pillow hand smell like lead mattress safe load mags ready blast flag wipe blowout speed ball dress tactical swag look pocket zero fuck pull custom glocks wear multicams date bitch operate crazy drink sip whiskey come ridin dirty word face bitch operate bitch operate bitch operate chillin range rate sustain lead shower wanna rain cclamp like motherfuckin boss hogg patch damn morning tiptoein hallway wife hear instagram game lock especially bunnies droolin cock crew like best drop load suppress people haters gonna hate like bitch operate crazy drink sip whiskey come rid dirty word face bitch operate bitch operate bitch operate,129,0.000730994,0.15820642,0.000730994,0.000730994,0.000730994,0.000730994,0.000730994,0.000730994,0.53690143,0.000730994,0.25403454,0.000730994,0.000730994,0.000730994,0.000730994,0.000730994,0.613343442,0.750890957,0.229918906,0,0.630049464,0.847843096,obscene,0.057142857
38221,miranda lambert,smoking jacket,2016,country,want smoke jacket deeper pocket money burn want know status make habit love hurt heavy pedal know slow continental know home want smoke jacket classic live bourgeoisie want heart tragic make magic night like nicotine chanel light strike wait exhale want smoke jacket deeper pocket money burn want know status make habit love hurt refine define hold need like wear smoke ring want want want want smoke jacket light match kerosene want want want smoke jacket want want want smoke jacket,81,0.000907441,0.000907441,0.018787786,0.000907441,0.000907441,0.000907441,0.065820561,0.000907441,0.301586765,0.029254577,0.000907441,0.148072866,0.000907441,0.077738834,0.046298109,0.000907441,0.51695007,0.651334513,0.472891037,0.031275304,0.133347073,0.560546836,obscene,0.057142857
38224,charles kelley,lonely girl,2016,country,matter cry wasn dream gotta tell wasn good lonely girl girl record room lonely lonely girl yeah worry gonna need gonna close eye body want lonely girl girl record room lonely lonely girl yeah lonely girl lonely girl lonely girl lonely girl sound heartbeat rhythm sound heartbeat rhythm lonely girl girl record room lonely lonely girl yeah yeah feel heartbeat rhythm lonely lonely girl,64,0.000848896,0.000848896,0.000848896,0.000848896,0.087579444,0.000848897,0.000848896,0.000848897,0.000848896,0.089014145,0.000848896,0.000848896,0.000848896,0.276711483,0.372013566,0.022125845,0.779053395,0.757916058,0.073292242,0,0.73928277,0.663653159,sadness,0.057142857
38227,miranda lambert,use my heart,2016,country,throw line reel throw dart stick think love make sick nerve heart nerve heart write line sing song momma home think love make sick nerve heart nerve heart throw punch turn cheek church believe shit wouldn difference think love make sick nerve heart nerve heart nerve heart nerve heart mmmmm nerve heart mmmmm heart,54,0.001385042,0.169748895,0.001385042,0.001385042,0.001385042,0.001385042,0.107162975,0.137598598,0.062219334,0.120420119,0.001385042,0.001385042,0.001385042,0.001385042,0.384844538,0.001385042,0.324163327,0.674101992,0.209838564,0.004615385,0.14983512,0.658647998,sadness,0.057142857
38235,cody jinks,hand me down,2016,country,hand hand come come hand hand hand come come hand hand evenin news hand point view hand war hand hand politicians hand hypocrites hand false laws hand latest brand hand hand come come hand hand hand come come hand good time come good time go hand go wrong hand ashamed truth bring life life bring slay hand hand come come hand hand hand come come hand hand weekly tithe hand thoughts life hand book read handout need hand hand come come hand hand hand come come hand good time come good time go hand go wrong hand ashamed truth bring life life bring slay hand hand hand,107,0.199361235,0.067579352,0.142832295,0.03037992,0.00055991,0.00055991,0.442356831,0.00055991,0.00055991,0.00055991,0.00055991,0.00055991,0.00055991,0.00055991,0.00055991,0.110211533,0.505036283,0.776145425,0.041766106,0.447368421,0.142621599,0.526511739,romantic,0.057142857
38236,high valley,i be u be,2016,country,soldier line courage heart fight outlaw bounty head shelter safe place rest weakness stayin strong sunrise night long darlin perfect life incomplete linger singer song singer song sinner salvation savin soul sailor ragin seas lighthouse guide weakness stayin strong sunrise night long darlin perfect life incomplete linger singer song singer song weakness stayin strong sunrise night long darlin perfect life incomplete linger singer song singer song,66,0.093079259,0.066417934,0.351011372,0.20918131,0.001594896,0.001594896,0.001594896,0.001594896,0.001594896,0.206009605,0.001594896,0.001594896,0.001594896,0.001594896,0.053566867,0.001594897,0.411892126,0.763377176,0.007428722,0,0.402308326,0.746738837,world/life,0.057142857
38250,turnpike troubadours,come as you are,2016,country,rid heel seven stone laughin drink stitch quick come unsewn right go come leave smile style play mornin start sound walkin away sound walkin away shape younger thoughts tonic fumblin darlin click heel come leave smile style play mornin nothin sound walkin away sound walkin away coffee head blind tie blow word talk friend lord godsend heart changin mind come leave smile style play mornin start sound walkin away sound walkin away sound walkin away,75,0.059195106,0.000835422,0.000835422,0.000835422,0.000835422,0.042427645,0.000835422,0.000835422,0.322492443,0.189125377,0.076554284,0.000835422,0.000835422,0.000835422,0.29934466,0.000835422,0.456298061,0.715919288,0.28313181,0,0.362118714,0.366346577,obscene,0.057142857
38257,miranda lambert,things that break,2016,country,bear bull china cabinet draw delicate like magnet perfume bottle mirror temper glass window pane timeless face pocket watch time tick leave ruin cause know hard things matter hold heart tight shatter stay away things break promise best intentions drive rundown engine blanket underneath hollow tree wind blow hard fall stick long time tick leave ruin cause know hard things matter hold heart tight shatter stay away things break wanna close hold responsible pain somebody break leave ruin cause know hard things matter hold heart tight shatter stay away things break,91,0.000762777,0.000762777,0.000762777,0.025287519,0.000762777,0.000762777,0.107442396,0.257900214,0.000762777,0.000762777,0.161160201,0.038952111,0.000762777,0.000762777,0.36886056,0.015608778,0.486624066,0.686511294,0.24196711,9.83E-05,0.448680956,0.563549933,sadness,0.057142857
38258,dierks bentley,can't be replaced,2016,country,jacket break right leave bleachers friday night felt cool stonewash fade things replace runaround freedom summer spinnin bottle time sum memorex mixtape things replace woah matter hard woah money world miss want nice life work like damn close things replace things replace hair heart gold cavalier backroad boone farm kiss taste things replace woah matter hard woah money world miss want nice life work like damn close things replace things replace woah years right single kid wife friends come come things replace woah matter hard woah money world miss want nice life work like damn close things replace things replace woah woah,102,0.00074129,0.00074129,0.365428396,0.02999541,0.00074129,0.037033933,0.051102598,0.00074129,0.230405952,0.00074129,0.00074129,0.044798456,0.016121631,0.111529844,0.027215067,0.036967919,0.526697715,0.72563649,0.238955059,0.001396761,0.333264633,0.613601546,world/life,0.057142857
38260,keith urban,worry 'bout nothin',2016,country,acres path long leaf pin little piece paper say long daylight end gonna worry bout nothin gonna worry bout nothin tryin money money gonna doin nothin want tryin money money gonna doin nothin spend little time sittin lookin pretty sunset tree line halfdrunk feelin smile start kickin gonna worry bout nothin sittin lookin pretty sunset tree line sparkin feelin smile start kickin gonna worry bout nothin blue highway paint desert vegas strip sleepy hometown street light blacktop die gravel begin skinny dippin river bend gonna worry bout nothin gonna worry bout nothin paint roof city kickin couple hippies yeah smoke whiskey blend gonna worry bout nothin paint roof city kickin couple hippies yeah smoke whiskey blend gonna worry bout nothin tryin money money gonna doin nothin want tryin money money gonna doin nothin spend little time sittin lookin pretty sunset tree line halfdrunk feelin smile start kickin gonna worry bout nothin paint roof city kickin couple hippies yeah smoke whiskey blend gonna worry bout nothin,165,0.000401768,0.000401768,0.000401768,0.022257717,0.023927069,0.112116303,0.000401768,0.000401768,0.476070885,0.000401768,0.229436798,0.000401768,0.000401768,0.000401768,0.000401768,0.000401768,0.545109932,0.76165936,0.004737957,5.88E-05,0.876339654,0.844839999,obscene,0.057142857
38270,casey donahew,kiss me,2016,country,steppin stone go better play mind silence know care know reason dream say waitin kiss waitin window open steal heart waitin kiss little game feel live life afraid know truth say walk away need stay want wrap arm say waitin kiss waitin window open steal heart waitin kiss waitin waitin waitin kiss waitin waitin waitin kiss waitin kiss waitin window open steal heart waitin kiss waitin kiss waitin window open steal heart waitin kiss waitin waitin waitin kiss waitin waitin waitin kiss,82,0.000641849,0.000641849,0.03205137,0.000641849,0.000641849,0.014571786,0.205689469,0.069881135,0.392461087,0.000641849,0.000641849,0.000641849,0.000641849,0.000641849,0.277001123,0.000641849,0.56460522,0.796451555,0.010440774,0,0.486809563,0.916914322,obscene,0.057142857
38283,jelly roll,zombie (feat. madchild & insane clown posse),2016,country,hear allow good time tell smile frown shoot time fly point turn level head oneway track tell road goal hold think okay date promise lose escape scary world cliché true gotta tryin edge seat constantly contain kinetic energy constantly reign sweet hum tune sleep watch peak stay good advice come come whoah yeah advice come come whoah yeah shout hand care stop hate replace eye focus place design peace refrain race kill race hear time take difference near gonna try fear real hide tear flow beat right advice come come whoah yeah advice come come whoah yeah,97,0.092278375,0.308633421,0.082838313,0.064845196,0.066442887,0.000762777,0.05790307,0.070172649,0.066210158,0.0265033,0.0529346,0.000762777,0.000762777,0.000762777,0.000762777,0.037045735,0.770388823,0.739096993,0.001505022,0,0.160140148,0.604592256,violence,0.057142857
38290,high valley,dear life,2016,country,dear life know love mile road share hit miss try ditch dear life know dear life plan suppose right leave dream dear life plan fly fast fight beggin slow scar death tryin catch breath wanna hangin dear life dear life hangin dear life dear life dear life look read page book ones dear life look fly fast fight beggin slow scar death tryin catch breath wanna hangin dear life dear life hangin dear life dear life wanna leave break heart live loud forever echo dark wanna leave break heart live loud forever echo dark fly fast fight beggin slow scar death tryin catch breath wanna hangin dear life dear life hangin dear life dear life,115,0.000521105,0.206841707,0.305569849,0.000521105,0.000521105,0.000521105,0.221903524,0.000521105,0.061143984,0.000521105,0.000521105,0.02867783,0.000521105,0.000521105,0.049499995,0.000521105,0.533196144,0.750993513,0.017970902,0,0.437345425,0.880877161,world/life,0.057142857
38292,miranda lambert,to learn her,2016,country,learn worst dance drink hold hurt sorry work learn things learn meet momma daddy know thanksgiving dinners sunday morning church true try table turn learn things learn lesson bless know hate leave ring lose work learn things learn learn things learn,41,0.001422475,0.001422475,0.427638453,0.001422475,0.001422475,0.078655925,0.001422475,0.229490734,0.001422475,0.001422475,0.192777227,0.051523009,0.001422475,0.001422475,0.001422475,0.001422475,0.411892126,0.705509833,0.189758223,1.89E-05,0.293075021,0.406387867,world/life,0.057142857
38296,jason aldean,this plane don't go there,2016,country,moment close eye window seat midnight lean park wish spot second right say goodbye plane plane time night swear plane wish runway light land thing tonight right wait gate stop reach drivers door yesterday today plane plane time night swear plane yeah plane plane time night swear plane plane,49,0.001461988,0.001461988,0.001461988,0.361810271,0.032729589,0.001461988,0.054918727,0.001461988,0.001461988,0.001461988,0.232724325,0.116681625,0.001461988,0.001461988,0.160745295,0.001461988,0.545109932,0.819526703,0.073693849,0,0.579554823,0.898895741,night/time,0.057142857
38303,upchurch,donald trump,2016,country,church bandplay snatch pussies like trump stay crackers like trump surround bitch like trump winnin like trump phone ring time shit service bout throw window wheel tryin curb people hatin people say gonna flop girlfriend repeat everytime fuckin album drop stare face paint goin tat hand scar knuckle dash stay pokin competition like thorns somebody load garbage trash dump drop motherfucker inmates sheriff speed dial police country shut fuck face snatch pussies like trump stay crackers like trump surround bitch like trump winnin like trump church shit stay preachin grouper folks shit country read lyric fuck want breakin contact fuck music stay pissin contract value stack cameraman makin look like jackass shit party south goin tubs jeep climbin people mountains cars shit illest hillbilly grimiest bar label fuckin cause shit fuck throw slammer cause roll trump makin america better bitch snatch pussies like trump stay crackers like trump surround bitch like trump winnin like trump know awfully good temperament trump charge country trump jail moderator secretary,166,0.000619195,0.000619195,0.000619195,0.000619195,0.000619195,0.000619195,0.000619195,0.000619195,0.667936706,0.000619195,0.173252049,0.000619195,0.000619195,0.093377104,0.000619195,0.017172643,0.798548684,0.731174525,0.256023349,0,0.840272053,0.870866838,obscene,0.057142857
38307,cole swindell,party wasn't over,2016,country,little blue buzz bare foot say hop truck right away run kinda girl walk lonely world dark light summer go wind reason spend nights somebody somebody shoulda tell party party wasn hand sway band love play boondocks sweet talk walk moon rock wish somebody woulda tell party party wasn party party wawawasn hear laugh like happen like magic habit disappear kinda mind matter hard think lesson learn world turn guess time turn drink somebody somebody shoulda tell party party wasn hand sway band love play boondocks sweet talk walk moon rock wish somebody woulda tell party party wasn days hear wave crash carry away strait slow dance sand cold hold hand somebody somebody shoulda tell party party wasn hand sway band love play boondocks sweet talk walk moon rock wish somebody woulda tell party party wasn wasn yeah party party party wasn hand sway band play damn party wasn party party party wasn party party party wasn,157,0.000381388,0.000381388,0.000381388,0.000381388,0.007826522,0.000381388,0.075055539,0.151183649,0.361887822,0.053947796,0.088706978,0.11411581,0.000381388,0.015065398,0.056160672,0.072617319,0.449799632,0.821834218,0.069376576,0,0.53936521,0.909907096,obscene,0.057142857
38313,brothers osborne,pawn shop,2016,country,bill need cash like yesterday junk lay credit check bring pawn shop gun guitars stop cost live cheap vinyl record dvds pawn shop jewel tool spot matter goods thing want sell pawn shop street texaco neon sign say gold pain pleasure trash treasure pawn shop gun guitars stop cost live cheap vinyl record dvds pawn shop jewel tool spot matter goods thing want sell pawn shop girl dress mess tool secondhand suit picture frame nintendo game cheap gold necklace stranger pawn shop gun guitars stop cost live cheap vinyl record dvds pawn shop jewel tool spot matter goods thing want sell pawn shop pawn shop,105,0.001196172,0.001196172,0.170479302,0.001196172,0.001196172,0.001196172,0.001196172,0.001196172,0.447749568,0.001196172,0.174384908,0.001196172,0.001196172,0.045705413,0.001196172,0.001196172,0.626340301,0.75976207,0.082529199,2.19E-05,0.975267931,0.885882322,obscene,0.057142857
38316,randy rogers band,tequila eyes,2016,country,look place shade neon face like hide smoky wall look good damn midnight tear tequila eye make want save pain disguise come undo cause hide truth try right tequila eye notice walk stool need friend look like girl trouble past kill shoot glass catch tequila eye make want save pain disguise come undo cause hide truth try right tequila eye hide truth die tryin right tequila eye right tequila eye tequila eye tequila eye tequila eye,76,0.000877193,0.327229733,0.000877193,0.044644809,0.000877193,0.000877193,0.000877193,0.075729094,0.036021726,0.000877193,0.000877193,0.109000744,0.015974678,0.15307483,0.176804677,0.017135495,0.577602079,0.748839833,0.043974944,0.105263158,0.348722176,0.670660385,violence,0.057142857
38321,upchurch,shit bubba,2016,country,truck nut swingin diesel fuel fill copenhagen black coffee string glass like kiss country fit right blue dark blue goin boys deer playin tannerite bonfire night wheel spinnin drive shaft fall hell yeah hell gun gonna stay rebel flag porch support white blue creek squad shit runnin round tennis shoe spittin like whiskey rhythm hidin woods comin kill yeah boys better duck cause buildin dynasty shit like liquor store tennessee shit better shit straight stay comin stick state creek water moccasin time clockin shit shit shit shit better shit straight shit shit shit shit talk shit talkin shoot fortyfive bullets blood arm cause stay slittin deers throats vorhees blood trench coat hillbilly magazine centerfold good fuck magazine watch movie tombstone hard rambo menace sippin shine road hell clothe rockin special women dress wear dresser pretty boys nowadays shit eyebrows droppin transmissions poppin wheelies lifestyle giddy bitch need fuck seabiscuit people callin cracker shit better triscuit neck line hell willin risk redneck bitch heavily connect shit better shit straight stay comin stick state creek water moccasin time clockin shit shit shit shit better shit straight shit shit shit shit,188,0.000442282,0.06294867,0.000442282,0.000442282,0.022244013,0.000442282,0.017969216,0.000442282,0.626457865,0.015332597,0.199313317,0.01904583,0.000442282,0.000442282,0.000442282,0.000442282,0.780136467,0.567853755,0.141565403,0,0.625927453,0.642631482,obscene,0.057142857
38326,cody johnson,billy's brother,2016,country,bull fight lead gonna fight gonna fight brother feelin like superman cold beer hand waitin week long jukebox shadowbox nothin lipstick shoot little fireball shoot little ball wall crowd need smoke toke cause tonight burnin step right pay little cover drink bunch redneck mother light lead gonna fight gonna fight brother gonna fight gonna fight brother yonder come plow trash talkin cowboy actin like feet tall kissin ontrea hell date bathroom stall roof higher proof howlin like bluetick hound steady beer flow go circus come yeah step right pay little cover outdrink bunch redneck mother light lead gonna fight gonna fight brother gonna fight gonna fight brother goin fine till moonshine spill drink know better hell know better rared take swing say step right pay little cover outdrink bunch redneck mother light lead gonna fight gonna fight brother gonna fight gonna fight brother bull fight lead gonna fight gonna fight brother,151,0.000457666,0.324541874,0.000457666,0.052293217,0.016490292,0.131409331,0.000457666,0.000457666,0.152328968,0.000457666,0.080959561,0.04081307,0.024856407,0.000457666,0.000457666,0.000457666,0.441135059,0.781016845,0.027709867,0,0.313685078,0.939938064,violence,0.057142857
38342,murphy elmore,one night stand,2016,country,tire wakin lookin jeans pickin heel walkin happen lookin thinkin hell smoke clear night stand wall number phone know flash fade memories night wanna walk night stand remember wakin sleepy little smile lookin tell hell happen think thats leave smoke cigarette clear things learn feelin lyin leavin end anyways night stand wall number phone cause know tire wakin lookin jeans pickin heel walkin,63,0.001074114,0.173228952,0.066378243,0.104413032,0.001074114,0.023442256,0.001074114,0.200258366,0.357750871,0.001074114,0.001074114,0.001074114,0.001074114,0.001074114,0.047654598,0.001074114,0.453048847,0.729738738,0.036043209,0,0.300288541,0.755748127,obscene,0.057142857
38343,taylor acorn,what do i do,2016,country,sittin barstool tryin sillhouettes dancin slow cigarette smoke neon light eye pick line girl treat right home hand thigh like search bottle know anymore start miss drink bartender bring round settin lose hallways wall tryin drown thoughts whiskey rock tryin pretend miss cause searchin bottle know anymore start miss drink bartender bring round settin start miss drink bartender bring round settin sittin barstool tryin sillhouettes dancin slow cigarette smoke,69,0.001012146,0.001012146,0.001012146,0.001012146,0.001012146,0.001012146,0.001012146,0.149836119,0.309593284,0.001012146,0.321735117,0.070583894,0.001012146,0.032414581,0.001012146,0.062975022,0.631755659,0.743558188,0.12550113,0,0.442497939,0.777770837,obscene,0.057142857
38349,charlie farley,concrete dreams (feat. cody davis),2016,country,good lips want lose arm goodbye leave eye dear take heart good lips want lose arm goodbye leave eye dear take best rest baby,24,0.043558763,0.002105263,0.108004318,0.002105263,0.002105263,0.002105263,0.380755798,0.002105263,0.002105263,0.002105263,0.002105263,0.002105263,0.002105263,0.002105263,0.275986715,0.08220155,0.586266652,0.810732508,0.006766071,0,0.487840066,0.813807999,romantic,0.057142857
38351,kip moore,separate ways,2016,country,tellin long cause dark dungeon lie bunk hear sound checkin sure city play whiskey crave whiskey crave light hometown girl think want whirl probably gonna baby damn sure baby drink smoke like okay guess goin separate ways night start dial number hang rehearse mind tongue stick tonight gonna close eye call baby gonna baby drink smoke like okay guess goin separate ways separate days separate nights wishin wonder tell livin dream livin hell sure doin drink smoke like okay guess goin separate ways,83,0.064786846,0.000773994,0.052193852,0.056762537,0.000773994,0.000773994,0.000773994,0.133100215,0.357806245,0.000773994,0.145263515,0.070492254,0.000773994,0.05073252,0.000773994,0.000773994,0.725982887,0.712381099,0.145581471,8.13E-05,0.618713932,0.483467352,obscene,0.057142857
38356,jelly roll,tennessee rap,2016,country,bass bass fuck switch yeah bass fuck switch yeah,9,0.010526316,0.010526316,0.010526316,0.010526316,0.410526316,0.010526316,0.010526316,0.010526316,0.410526316,0.010526316,0.010526316,0.010526316,0.010526316,0.010526316,0.010526316,0.010526316,0.509368569,0.675948004,0.014858449,5.88E-05,0.136438582,0.54453032,obscene,0.057142857
38358,gary allan,do you wish it was me?,2016,country,elevate plateau try sense mind state life know swear home place know comfort zone place comfort zone yeah finally place go regulate peace mind music life good feel time come remain protect real hard regain perspective look straight line look work track forget life short mood feel right right forget life short mood feel right right elevate plateau try sense mind state life know swear home place know comfort zone place comfort zone patient right like open feel good time go right state mind get late short span time share world fine message vibe feel alright forget life short mood feel right right forget life short mood feel right right,110,0.000598086,0.000598086,0.399001428,0.287351495,0.012987876,0.000598086,0.000598086,0.073710523,0.000598086,0.047699898,0.000598086,0.000598086,0.000598086,0.035701084,0.000598086,0.136370662,0.600346583,0.745199087,0.240963093,6.85E-06,0.454863974,0.592579868,world/life,0.057142857
