,artist_name,track_name,release_date,genre,lyrics,len,dating,violence,world/life,night/time,shake the audience,family/gospel,romantic,communication,obscene,music,movement/places,light/visual perceptions,family/spiritual,like/girls,sadness,feelings,danceability,loudness,acousticness,instrumentalness,valence,energy,topic,age
39066,adam calhoun,huck fosier,2018,country,song fuckin warn comin motherfuckers diss comin door reply lelelet clear country shit hear move inch years stick shiftin gear write rap crayon hosier like dozen fan know fuckin cousin talkin shit throw hand bitch right switch side ride straight midnight wrong tryin half write song half doin shit build ruin time bitch stage grabbin talkin beers drink braggin can camo ammo seethrough talk tough fuck toss trunk punk hillbilly kill fuck chicken summer time buyin chili touch feel choke hater copenhagen dope fuck mistakin hickhop shit vacant hold hold hold hold fuck time redneck rave shit motherfuckers think wasn gonna talk shit sadly motherfuckin mistake check motherfuckers wanna talk gonna piss somebodies boot motherfuckin reason gonna step bitch motherfuckin problem sure motherfuckin truck bitch think harm teeth zone army quit talkin light upstairs nobodies home nobodies shit fight want unlikely stomp wing boot soft shit fuck pull shotgun bullets wreck body body hear bullshit body go check waitin test runnin mouth safety lord mean react mean hear bunch virgins fuck bitch weak verse curtain oppose fact show game,179,0.000491884,0.03302661,0.000491884,0.000491884,0.000491884,0.010676768,0.041684614,0.071796538,0.590293643,0.075162486,0.106415483,0.024317667,0.000491884,0.000491884,0.000491884,0.000491884,0.696739955,0.737327898,0.01726809,0,0.429101401,0.777770837,obscene,0.028571429
39067,upchurch,river rat,2018,country,church creek squad haha land meet park circle pull single like need shotgun seat look sketch bring friends babe grip hand pupupull parkin scar shit know bitch hell mama raise bitch raise hellion know raise crazy motherfucker right creek squad river river river shotgun tint glass license expire identify tat creeker grave lock weld shut bury ghost ranch middle finger point roosters white church corner jaybirds close decade prolly blblack mark pavement street light buzzin barely work hill eye part best sure passin go horse load piss daddy crazy motherfuckin thief white crackhead shit lock gate load gun clean plate pitch black come missin acres pupupull parkin scar shit bitch hell mama raise bitch raise hellion know raise crazy motherfucker right river river river shotgun tint glass license expire identify tat creeker grave lock weld shut bury ghost ranch middle finger point,142,0.020287151,0.335414817,0.000611995,0.000611995,0.000611995,0.055560452,0.000611995,0.000611995,0.220160192,0.000611995,0.258216777,0.000611995,0.000611995,0.000611995,0.000611995,0.000611995,0.861366836,0.79686178,0.02610344,0,0.441467436,0.722714063,violence,0.028571429
39071,uncle kracker,floatin',2018,country,rumour go deep cause girl leave bust drive coast weekend mean give floatin ocean hold pattern little breather jump need break break poor heart shatter think hang disasters face south daytona hard look lonely koozie wrap corona sand floatin ocean hold pattern little breather jump need break break poor heart shatter think hang disasters rumor go deep cause girl leave bust drive coast weekend months floatin ocean hold pattern little breather jump need break break poor heart shatter think hang floatin ocean hold pattern little breather jump need break break poor heart shatter think hang disasters,96,0.000773994,0.000773994,0.000773994,0.000773994,0.051687881,0.128993258,0.058535966,0.042530037,0.000773994,0.000773994,0.174285914,0.000773994,0.000773994,0.044895843,0.353227189,0.000773994,0.609011156,0.79360562,0.09256937,0,0.621805441,0.852848257,sadness,0.028571429
39080,katie noel,diesel gang,2018,country,yeah diesel gang seven tree blow blowin smoke yeah diesel gang gang gang dodge gang yeah gang turbo sing rippin gear ring power stroke blowin smoke stand pip choke diesel gang gang gang dodge gang yeah gang diesel gang steal bitch truck quick gotta goodies pillar coke feelin diesel mornin yeah smell aroma smell diesel hear girl leave cause drive tacoma stuntin lookin like money clean cummins yeah truck jack lookin like cloud prayin tranny fall yeah gear second gear feelin kinda heavy dollars sittin pretty wheel flex white open doors inside diesel gang gang gang dodge gang yeah gang turbo sing rippin gear ring powerstroke blowin smoke stand pip choke diesel gang gang gang dodge gang yeah gang transmission duramax shakin glass yeah cause systems like coal buddies feelin real cool rippin gear listen mornin yeah bout fire cause night yeah little wild couple good buddies truck solo raise diesel gang gang gang dodge gang yeah gang turbo sing rippin gear ring power stroke blowin smoke stand pip choke diesel gang gang gang dodge gang yeah gang diesel gang yeah diesel gang,183,0.000626566,0.137973211,0.000626566,0.000626566,0.19313419,0.024106576,0.000626566,0.000626566,0.300878656,0.08570927,0.217003594,0.000626566,0.000626566,0.033675705,0.000626566,0.000626566,0.961009423,0.658616004,0.131525232,0,0.426009893,0.539525158,obscene,0.028571429
39105,kelsea ballerini,graveyard,2018,country,wanna skeleton closet throw cause know okay stone road forget cause fall fast dash date wanna heart graveyard cold hard dirt throw wanna watch drive away black hopeless break girl little black dress break heart rest peace right maybe naive believe hurt know hide darkest suit shade know hand shoe dirty guess need shovel grave wanna heart graveyard cold hard dirt throw wanna watch drive away black hopeless break girl little black dress break heart rest peace right yeah gonna night cause ghost break heart stay feet yeah gonna night cause ghost break heart stay feet wanna heart graveyard cold hard dirt throw wanna watch drive away black hopeless break girl little black dress break heart rest peace right hopeless break girl break heart rest peace right wanna heart wanna heart graveyard babe graveyard,134,0.010733283,0.173163622,0.00044603,0.048121901,0.02903573,0.033348924,0.00044603,0.00044603,0.00044603,0.00044603,0.144373395,0.00044603,0.036900176,0.060705223,0.357632885,0.00044603,0.520199285,0.742737738,0.195782325,3.61E-06,0.397155812,0.748740902,sadness,0.028571429
39107,upchurch,we don't,2018,country,church yeah creek squad motherfucker roll biatch skrrt church yeah night break floor venue ragin bitch like gonna tomorrow hangin rafter screamin come sound roll doobie beer sprayin like winners circle grab checker flag career look like daytona time donuts blowin smoke look like dunkin flame dopest country everybody know fuckin care bout care bout party stop care bout care bout party stop tour legendaries ziploc orange hairy seat brrrah bitch raise ashland city sheriff shoot shit know smoke weed tell wear helmet ridin wheelies street creek squad cattle prod house log boss presley generation stick music chart bitch go gold know flame mainstream comb care bout care bout party stop care bout care bout party stop care bout care bout party stop care bout care bout party stop,129,0.000619195,0.000619195,0.000619195,0.022251747,0.028555976,0.000619195,0.000619195,0.141095701,0.534173839,0.000619195,0.166760356,0.039839901,0.000619195,0.000619195,0.000619195,0.000619195,0.561356006,0.803579212,0.001615463,4.60E-05,0.667147568,0.908906064,obscene,0.028571429
39113,george strait,codigo,2018,country,baby like plan want beautiful high perfect recipe baby secret pour right talkin bout código best tequila baby know little ready roll mexico little state call jalisco beautiful agaves grow talkin bout código like wanna care habit long hasta cruz sing home song talkin bout código best tequila baby know little ready roll mexico little state call jalisco beautiful agaves grow talkin bout código come boys straight rock dress surprise throw close eye talkin bout código best tequila baby know little ready roll mexico little state call jalisco beautiful agaves grow talkin bout código talkin bout código best tequila baby know little ready roll mexico little state call jalisco beautiful agaves grow talkin bout código beautiful agaves grow talkin bout código,121,0.081058602,0.000572082,0.000572082,0.000572082,0.000572082,0.148385184,0.000572082,0.07065661,0.464491288,0.072155912,0.000572082,0.000572082,0.000572082,0.126647163,0.000572082,0.000572082,0.578685151,0.785426762,0.480923174,2.30E-05,0.847485573,0.77476774,obscene,0.028571429
39115,buddy brown,just sayin',2018,country,trust like dog talk high school talk need good friends bout sayin count favor cept truck bring better gas sayin yeah go hell everybody know change world blow stay country ball boot missile range jong lookin fight right shake hand know playin yeah everybody thinkin days sayin yeah country boys look plastic support troop kick liquor store uncle pass sayin understand vegan come like eatin lecture huntin beatin sayin yeah go hell everybody know jail know gonna blow stay country ball boot missile range jong lookin fight right shake hand know playin yeah everybody thinkin days sayin stay country ball boot missile range jong lookin fight right shake hand know playin yeah everybody thinkin days sayin hell stay country ball boot missile range jong lookin fight right shake hand know playin yeah everybody thinkin days hell sayin,137,0.000474158,0.042877334,0.069666444,0.000474158,0.129061119,0.000474158,0.000474158,0.000474158,0.506799713,0.000474158,0.203852231,0.000474158,0.032223263,0.000474158,0.000474158,0.000474158,0.615509585,0.737917596,0.003814261,8.92E-05,0.670239077,0.816811096,obscene,0.028571429
39125,morgan evans,things that we drink to,2018,country,gonna raise tall glass tonight look life live yeah things drink roads choose friends turn miss hearts break word ones line cross ones tear cry dream dream star burn star reach picture stories tell moments gonna raise tall glass tonight look life live yeah things drink shed little light memory kinda make feel like little lose yeah things drink hurt heal songs sing know tomorrow bring battle fight war pain things drink things drink gonna raise tall glass tonight look life live yeah things drink wonder time go change thing tryna miss yeah things drink things drink things drink tryna miss yeah things drink,104,0.000531632,0.000531632,0.326602191,0.044823989,0.062786627,0.01840846,0.000531632,0.000531632,0.033619386,0.028223039,0.285968303,0.038733255,0.000531632,0.000531632,0.079159928,0.044613789,0.539694574,0.704920134,0.030119508,2.35E-06,0.267312448,0.532517932,world/life,0.028571429
39127,thomas rhett,cardboard heart,2018,country,carve initial live tree hand hand brand concrete change like weather cold girl oughta wear sweater know forever temporary wish cardboard heart wouldn hurt apart movin wouldn dang hard cardboard heart fold fold yeah fold fold prescription breakup drama kind physician trauma plane hawaii class brand know play like ukulele wish cardboard heart wouldn hurt apart movin wouldn dang hard cardboard heart fold fold yeah fold fold oughta head grab stick chest know real feel pain sing feel wish cardboard heart wouldn hurt apart movin wouldn dang hard cardboard heart fold fold yeah fold fold fold fold yeah fold fold,100,0.00093985,0.00093985,0.042150089,0.00093985,0.07361561,0.00093985,0.00093985,0.176223497,0.00093985,0.037654311,0.154257308,0.00093985,0.00093985,0.075474382,0.380078008,0.030248222,0.673995451,0.785401123,0.012348406,0,0.837180544,0.786780128,sadness,0.028571429
39128,kelsea ballerini,fun and games,2018,country,cool know like merrygoround need dramatic baby know word maybe maybe word come cause game poker face place hold close like card tell joker queen hearts queen spade stay time game wanna play play wanna play play good goodbye stick inbetween cause time fine lonely know table saturday night fatal care label cause game poker face place hold close like card tell joker queen hearts queen spade stay time game wanna play play wanna play play maybe circus leave game poker face place hold close like card tell joker queen hearts queen spade stay time game wanna play play wanna play play yeah think upperhand hand think upper hand hand cool know like merrygoround,114,0.016075594,0.000548246,0.000548246,0.052224469,0.014311048,0.000548246,0.088397692,0.172566842,0.3291513,0.000548246,0.000548246,0.000548246,0.000548246,0.129508298,0.129018427,0.000548246,0.653417091,0.760864549,0.10843284,0,0.598103875,0.732724385,obscene,0.028571429
39132,cale dodds,what we gonna do about it,2018,country,drink deep work week wide open dance floor damn drummers real good beat know goin takin choice gotta choose nothin lose come waitin night like night like ride like lookin good excuse yeah good excuse little loose know night moonlight better time waitin night like night like gonna gonna come goin school gonna sing party like know raise goin come waitin night like night like ride like lookin good excuse yeah good excuse little loose know night moonlight better time waitin night like night like gonna gonna stay goin young right waitin night like right like lookin good excuse good excuse little loose yeah waitin night like night like ride like lookin good excuse yeah good excuse little loose know night moonlight better time waitin night like night like gonna gonna tell gonna girl gonna yeah gonna tell gonna girl gonna,141,0.000401768,0.000401768,0.000401768,0.185466494,0.041183267,0.057923939,0.000401768,0.000401768,0.351525918,0.008814259,0.000401768,0.061184483,0.000401768,0.104782886,0.000401768,0.06886202,0.537528431,0.797272005,0.10843284,0,0.712489695,0.767760515,obscene,0.028571429
39134,carrie underwood,the bullet,2018,country,line limousines leave prayers pray hymn sing black mascara tear flowin blame hate blame gun mama suppose bury sons leave hole heart bullet keep goin branch family tree birthday live good life steal raise daughter wed wishin hand holdin till heart leave break break bullet keep goin grass grow stone friends stop checkin phone camera crew move wind open bullet keep goin branch family tree birthday live good life steal raise daughter wed wishin hand holdin till heart leave break break bullet keep goin yeah whoa line limousines leave prayers pray hymn sing mama suppose bury sons bullet keep goin raise daughter wed wishin hand holdin till heart leave break break bullet keep goin bullet keep goin,117,0.000649773,0.138545785,0.059646741,0.000649773,0.0253462,0.185531068,0.000649773,0.000649773,0.000649773,0.049324609,0.182337653,0.000649773,0.000649773,0.000649773,0.336901267,0.015219177,0.395646052,0.811501679,0.145581471,1.76E-05,0.138499588,0.678668643,sadness,0.028571429
39144,upchurch,dirty hat,2018,country,church bottleneck cash nasty shoulder pick favorite country rapper everybody know golden biggest number music country chart couple weeks come better drop albums years damn billboards kick twist number country album call night say drop worst time damn minute stapleton number right damn near shit pant summer break ghost month video million murder gettin motherfucking game like capcom fuck come cap white stick ridin country seat lean thinkin bout success underneath dirty underneath dirty underneath dirty thinkin bout success underneath dirty start leavin stick lockjaw fuckin game takin like saw bitch country rappin category want money fuck fame need fakin country real get wear dirty hat honkey hustler straight cracker talk number fake bitch haha steady makin hit redneck nation livin bold prediction hit million bottleneck upchurch hell gonna miss motherfuckin haters know kiss drivin country seat lean bunch fake bitch game fact damn view legend game nothin prove ridin country seat lean thinkin bout success underneath dirty underneath dirty underneath dirty thinkin bout success underneath dirty ridin country seat lean thinkin bout success underneath dirty underneath dirty underneath dirty thinkin bout success underneath dirty,185,0.000401768,0.034580674,0.000401768,0.000401768,0.000401768,0.000401768,0.015944261,0.000401768,0.551356701,0.000401768,0.37738315,0.000401768,0.000401768,0.000401768,0.000401768,0.000401768,0.847286906,0.786195934,0.027408662,0,0.738252267,0.726718192,obscene,0.028571429
39149,demun jones,feeling good,2018,country,feelin good catch south like black outrunnin sunrise feelin good devil alright feelin good oohooh oohahh good oohooh oohahh feelin good oohooh oohahh good oohooh oohahh demundemun jonesjones county zone go wind blow money headphones micro nomad runnin roads rockin show vocal recital makin sure hear rattlin rear view breakin speakers flippin fuse takin refuse money hustle turn little things want ourself daydream bring livin room right like livin dream wouldn know see look window clean feelin good catch south like black outrunnin sunrise feelin good devil alright feelin good oohooh oohahh good oohooh oohahh feelin good oohooh oohahh good oohooh oohahh livin slow crawl creepin drivin speedin mean rush racin button buckle flow field coyotes honeysuckles trouble stay livin present tense watchin news read nothin bout president obey long everybody watchin stop drop load dress chop gotta tookie puttin food table feelin good willin able able stay grizzly busy grateful stock lead animals hatefuls feelin good catch south like black outrunnin sunrise feelin good devil alright feelin good oohooh oohahh good oohooh oohahh feelin good oohooh oohahh good oohooh oohahh feelin good,183,0.000501253,0.098196566,0.000501253,0.000501253,0.000501253,0.000501253,0.000501253,0.000501253,0.29757527,0.000501253,0.173163628,0.029405656,0.000501253,0.067495202,0.000501253,0.320491242,0.70757067,0.762505448,0.065962918,0,0.636232481,0.644633546,feelings,0.028571429
39153,riley green,that's how ya left me,2018,country,bare foot run driver door stain concrete back street think real hard chase watch taillights fade know boot feel damn heavy leave leave leave like leave small road fade like favorite song radio leave like leave warm drink right like seat light come barely breathe watch leave lonely leave funny start right mornings scream cuss beat dash beat piece junk hop hear midnight train hold dogwood maybe time think turn leave like leave small road fade like favorite song radio leave like leave warm drink right like seat light come barely breathe watch leave lonely yeah leave decide wanna come cause know leave look pretty leave leave leave like leave small road fade like favorite song radio leave like leave warm drink right like seat light come barely breathe watch leave lonely leave yeah leave,135,0.000434972,0.000434972,0.000434972,0.042848713,0.019230499,0.000434972,0.000434972,0.000434972,0.000434972,0.0859422,0.245975941,0.054398448,0.000434972,0.14395251,0.375655081,0.000434972,0.477959493,0.790323821,0.02319179,0,0.507419621,0.794788386,sadness,0.028571429
39162,eric ethridge,if you met me first,2018,country,strangest creature fail prey like vulture hand follow follow follow life steal light sweet taste talk wanna face crowd friend failure trust gods couldn felt lose steal light sweet taste talk wanna face crowd steal light sweet taste talk wanna face crowd,42,0.001422475,0.414454968,0.001422475,0.001422475,0.001422475,0.001422475,0.141750615,0.151935448,0.001422475,0.001422475,0.001422475,0.161744053,0.001422475,0.001422475,0.001422475,0.001422475,0.268926676,0.761223496,0.345380869,0,0.227122836,0.552538578,violence,0.028571429
39163,chris lane,"new phone, who's this",2018,country,groove smooth finally move girl rebound rocket felt little buzz pocket guess shoulda know guess drop somebody list gotta phone yeah kick curb take favourite shirt nerve girl blow like yeah girl kid kill mess buzz cause texting miss want want kiss gotta phone think girl miss want dang yeah kick curb take favourite shirt nerve girl blow like yeah girl kid kill mess buzz cause texting miss want want kiss gotta phone groove smooth finally move yeah kick curb take favourite shirt nerve girl blow like yeah girl kid kill mess buzz cause texting miss want want kiss gotta phone recognise number delete,104,0.000701754,0.000701754,0.000701754,0.000701754,0.0870519,0.013713684,0.000701754,0.095482727,0.333149894,0.000701754,0.000701754,0.000701754,0.000701754,0.208023031,0.000701754,0.066500314,0.596014297,0.77655565,0.226906854,0,0.812448475,0.844839999,obscene,0.028571429
39167,russell dickerson,man in the mirror,2018,country,gonna change life gonna feel real good gonna difference gonna right yeah turn collar favorite winter coat wind blow mind kid street blind pretend need summer disregard break bottle soul follow wind know cause want know start mirror yeah ask change ways message clearer wanna world better place look change yeah yeah yeah victim selfish kinda time realize home nickel loan pretend deeply scar somebody break heart wash dream follow pattern wind place start start mirror yeah ask change ways message clearer wanna world better place look change cause start mirror ask change ways yeah message clearer wanna world better place look change start mirror ask change ways yeah message clearer wanna world better place look change gotta right time close mind mirror ask change ways yeah message clearer want world better place look gotta change mirror yeah change change change yeah gonna gonna gonna feel real good know change gonna feel real good know change yeah gonna change,159,0.000365497,0.035637236,0.330762512,0.000365497,0.113080063,0.000365497,0.000365497,0.15896479,0.000365497,0.072947884,0.047685457,0.000365497,0.000365497,0.000365497,0.057648823,0.066349018,0.770388823,0.70530472,0.548192317,2.10E-06,0.320898599,0.556542707,world/life,0.028571429
39178,colter wall,saskatchewan in 1881,2018,country,toronto away door wheat canola seed askin better fore produce prairie mean harm spend days makin wag farm eastern boys gonna twist damn cold wind half kiddin plow freeze mule livin icecold rainbow pickin fight mennonites raisin cane plantin grain workin night gonna know actin right toronto away door wheat canola seed askin better fore produce better fore produce,59,0.002024292,0.147351826,0.002024292,0.07406132,0.002024292,0.002024292,0.002024292,0.002024292,0.371536194,0.002024292,0.201725087,0.002024292,0.002024292,0.002024292,0.094264712,0.002024292,0.56460522,0.611619619,0.678714537,5.01E-05,0.530090684,0.366346577,obscene,0.028571429
39180,ashley monroe,hands on you,2018,country,wish lay hand show thing wish push wall lock door bathroom stall windows screen wish lay hand kind gonna bring knees wish cause wouldn wishin wish lay hand wish half drink tangle make instead head head regret wish lay hand high motel room little secret soul see know forbid company wish lay hand draw picture skin place wish lay hand wish half drink tangle make instead head head regret wish lay hand show thing wish push wall lock door bathroom stall windows screen wish lay hand kind bring knees wish cause wouldn wish wish lay hand,96,0.000634115,0.316206235,0.000634115,0.000634115,0.000634115,0.000634116,0.000634115,0.113835592,0.000634115,0.000634115,0.262096382,0.000634115,0.000634115,0.000634115,0.282144481,0.000634115,0.570020578,0.685716483,0.03142473,1.41E-05,0.292044518,0.415397158,violence,0.028571429
39182,lewis brice,blessed,2018,country,know familiar dream reflection asleep long time awake night look life apologies people things right guess realize past reason right matter fact apologize bitch piss cause constantly change think incarceration amaze zone roll stone come home gotta motherfucker know surrender surrender bring hell believe believe feel insincere like save life believe believe mind kill daddy jail smarter think plan listen attention post opinion get bigger trigger haha figure kicker trigger get richer offend bitter little twitter bitch mention look attention cause starve wanna music scene news like second come respawn like reset button hat trump radke rap act ratchet release kraken delete asses rapture motherfucking morning surrender surrender bring hell believe believe feel insincere like save life believe believe mind kill need miracle fall fast sink deep need watch sickness fuck have dream turn fuck music fuck daughter daughter year asleep long time fuck believe believe feel insincere save life believe believe mind cause try kill fall fast sink deep need watch sickness save life believe believe mind kill,169,0.000461681,0.11360236,0.384563859,0.090998215,0.000461681,0.019397713,0.000461681,0.040085161,0.236220272,0.032927325,0.000461681,0.000461681,0.000461681,0.000461681,0.000461681,0.032638294,0.580851294,0.798041176,0.005611451,0,0.716611707,0.882879225,world/life,0.028571429
39207,kacey musgraves,"oh, what a world",2018,country,world wanna leave kinds magic hard believe world wanna leave kinds magic hard believe northern light sky plant grow open mind things swim neon glow know real things real things world wanna leave kinds magic hard believe thank good true world know life billion time wish know matter cause right know feel real things yeah real things world wanna leave kinds magic hard believe thank good true world real things real things world kinds magic tell good true world world wanna leave kinds magic hard believe world wanna leave kinds magic hard believe world wanna leave kinds magic hard believe world wanna leave kinds magic hard believe,107,0.000554017,0.000554017,0.446857661,0.000554017,0.011868708,0.000554017,0.000554017,0.194894052,0.000554017,0.000554017,0.000554017,0.135016284,0.000554017,0.000554017,0.000554017,0.102189616,0.477959493,0.72886701,0.644577956,0.001447368,0.192085738,0.536522062,world/life,0.028571429
