,artist_name,track_name,release_date,genre,lyrics,len,dating,violence,world/life,night/time,shake the audience,family/gospel,romantic,communication,obscene,music,movement/places,light/visual perceptions,family/spiritual,like/girls,sadness,feelings,danceability,loudness,acousticness,instrumentalness,valence,energy,topic,age
39369,locash,feels like a party,2019,country,feel like party feel like party everybody show gotta park truck know party crowd speakers bang yeah place good thing decide roll tonight wanna miss feel like party feel like damn good time bunch country girls road boys drink sing pour cold cause bout leave feel like party feel like party wanna hand hand wanna hand hand time beat drop goin goin know stop come right feel like party feel like damn good time bunch country girls road boys drink sing pour cold cause bout leave feel like party feel like party look like party sound like party party taste like party shake like party party feel like party feel like damn good time bunch country girls road boys drink sing pour cold cause bout leave feel like party feel like party wanna hand hand wanna hand hand,138,0.000395726,0.000395726,0.000395726,0.037818183,0.009343314,0.000395726,0.000395726,0.000395726,0.417930074,0.03166422,0.194062164,0.000395726,0.000395726,0.112300363,0.000395726,0.135767109,0.532113073,0.786247212,0.055621542,0,0.75370981,0.879876128,obscene,0.014285714
39370,george strait,some nights,2019,country,take road lose hear wind fort heart hard caliche dirt days better mother gonna days wanna wanna start nights guess bother hell pick phone pride leave swallow tomorrow days better mother gonna days wanna wanna start nights days better mother gonna days wanna wanna start days better mother gonna days wanna wanna start nights nights take road lose,58,0.000956938,0.000956938,0.336963365,0.000956938,0.000956938,0.000956938,0.000956938,0.000956938,0.000956938,0.040871377,0.175341656,0.000956938,0.074096764,0.000956938,0.095879063,0.000956938,0.524531572,0.752788247,0.279115742,1.54E-05,0.31780709,0.632621159,world/life,0.014285714
39374,aaron watson,trying like the devil,2019,country,golden halo bandana blue jeans know good good good seldom fool play try best burn soak gasoline think learn learn think weigh heavy heart mind stumble step like wino walk line like tightrope walk heaven eye hell solid sink sand try like devil good beware break glass stare window soul judge bare know think weigh heavy heart mind stumble step like wino walk line tightrope walk heaven eye hell solid sink sand try like devil good fee crumb fall floor saint walk pearly lord sinner crawl backdoor think weigh heavy heart mind stumble step like wino walk line tightrope walk heaven eye hell solid sink sand try like devil good solid sink sand lord try like devil,117,0.000598086,0.356029085,0.000598086,0.000598086,0.000598086,0.037512258,0.000598086,0.118840142,0.000598086,0.016143918,0.000598086,0.125322438,0.000598086,0.076788561,0.192146342,0.070638307,0.51695007,0.746968182,0.010029127,0.000364372,0.618713932,0.79679045,violence,0.014285714
39377,granger smith,damn strait,2019,country,humid tell summer texas guy hook classic strait ride home today right mind leave damn strait piss peddle tearin right drive drive damn strait couple county reds neon dive damn strait wanna bartender comin night cause droppin quarter juke nonstop playin song steel whiskey somethin maybe wrong livin line right mind prayin late damn strait damn strait sing amarillo damn strait tip band play dance real close damn strait tryna goin movin droppin quarter juke nonstop playin song steel whiskey somethin maybe wrong livin line right mind prayin late damn strait know heart hear life hard tonight droppin quarter juke nonstop playin songs steel whiskey somethin maybe wrong cause livin line right mind prayin late think damn strait damn strait,120,0.000692521,0.000692521,0.000692521,0.301387069,0.000692521,0.000692521,0.000692521,0.000692521,0.457931286,0.120357967,0.091297002,0.000692521,0.000692521,0.000692521,0.019331384,0.000692521,0.51695007,0.803425378,0.034537183,0,0.538334707,0.848844128,obscene,0.014285714
39396,midland,cheatin’ songs,2019,country,jacket smell like cigarettes hat smoke hangin say know maybe crazy maybe maybe guilty maybe catch bringin cheatin songs kinda hurt get singin somethin circa lyin lyin bringin ring slip pocket tight fittin jeans fashion doin somebody wrong bringin cheatin songs home anymore puttin little black dress wearin maybe jealous wouldn lookin bringin cheatin songs kinda hurt get singin somethin circa lyin lyin bringin ring slip pocket tight fittin jeans fashion doin somebody wrong bringin cheatin songs steel guitars style like tear fallin smile yeah country music love fool run cool bringin cheatin songs kinda hurt get singin somethin circa lyin lyin bringin ring slip pocket tight fittin jeans fashion doin somebody wrong bringin cheatin songs bringin cheatin songs,119,0.00074129,0.00074129,0.00074129,0.00074129,0.015049254,0.0112292,0.044695345,0.19293624,0.322113043,0.168354107,0.097072428,0.00074129,0.00074129,0.00074129,0.091809204,0.04932828,0.716235243,0.772632874,0.04317173,4.04E-05,0.690849134,0.723715095,obscene,0.014285714
39400,caylee hammack,family tree,2019,country,sister smoke camels county week clean sneak smell like nocotine momma burn chicken tupperware party tonight daddy asleep chair blare stats halftime whoaohohohoh real life real funny whoaohohohoh money sing little higher hang want stay home matter cause root deep gonna shake family tree whoaohohohoh whoaohohohoh grandma sell maytag dryer post uncle bail hang laundry till snow hell cousins like sunday drive roll luck lunch high school high whoaohohohoh real life real funny whoaohohohoh money sing little higher hang want stay home matter cause root deep gonna shake family tree gonna shake family tree whoaohohohoh whoaohohohoh problems everybody alright plan plan gettin problems hell sing little higher hang want stay home matter cause root deep gonna shake family tree gonna shake family tree whoaohohohoh real life real funny whoaohohohoh money gonna shake family tree whoaohohohoh root deep whoaohohohoh nothin nothin gonna shake gonna shake family tree,146,0.000487329,0.000487329,0.034798607,0.02065131,0.000487329,0.100724009,0.000487329,0.000487329,0.343473152,0.062540147,0.095649396,0.072524911,0.122608415,0.009178751,0.000487329,0.000487329,0.675078523,0.795990052,0.015360457,0.002135628,0.531121187,0.854850322,obscene,0.014285714
39405,muscadine bloodline,put me in my place,2019,country,change hang run tie meet question stand right foot foot right lie leave selfish unprepared blame scar believe girl need heart break place friends list reason leave tonight argue say cave time cause different kind feel hit right foot foot right lie leave selfish unprepared blame scar believe girl need heart break place tell foot foot feel lie promise leave selfish unprepared blame scar believe girl need heart break place yeah heart break place,74,0.000809717,0.000809717,0.052038811,0.074338702,0.057090498,0.000809717,0.000809717,0.15642925,0.000809717,0.000809717,0.169472771,0.000809717,0.000809717,0.062717777,0.418195592,0.000809717,0.65991552,0.623362305,0.885542054,3.91E-06,0.395094806,0.427409545,sadness,0.014285714
39410,jake owen,señorita,2019,country,bar umbrella drink cars chop drop ridin street sand feet thinkin leave feelin word speak learn girl teach yeah señorita need lips like shoot tequila cómo dice think stay leave seat airplane thing lookin night mamacita movin paradise leave señorita señorita gonna time dance amor gonna loco night good wanna leave señorita need lips like shoot tequila cómo dice think stay leave seat airplane thing lookin night mamacita movin paradise leave señorita señorita sand feet lookin thinkin leave thinkin need thinkin word speak loca para learn girl teach señorita need lips like shoot tequila shoot tequila cómo dice think stay leave seat airplane thing lookin night toda noche mamacita movin paradise hasta paraíso leave señorita señorita,116,0.000711238,0.000711238,0.000711238,0.089046761,0.053257113,0.000711238,0.038926706,0.146401167,0.339348946,0.000711238,0.244991294,0.000711238,0.000711238,0.05226612,0.000711238,0.000711238,0.649084805,0.769863857,0.626505649,0,0.886644683,0.711702708,obscene,0.014285714
39416,ray fulcher,life after your leavin',2019,country,book open brand chapter knock couple years dust bass tracker jones jennys long mighta wake wagon rid sayin memory track pour little salt pain sayin hurt little walkin talkin proof like drink drinkin light long go tunnel life leavin reach picture dash throw silverado sick lookin cuttin tomorrow burn bridge heartache ville leave spot clock stand closin movin sayin memory track pour little salt pain sayin hurt little walkin talkin proof like drink drinkin light long go tunnel life leavin yeah heart beatin breathin finally gettin think maybe goin crazy rest peace sayin memory track pour little salt pain sayin hurt little walkin talkin proof like drink drinkin babe light long go tunnel baby life leavin babe light long go tunnel baby life leavin yeah alive surprise,127,0.052757809,0.000554017,0.10639544,0.061362172,0.021606648,0.074283636,0.000554017,0.000554017,0.309468417,0.000554017,0.142214126,0.062658006,0.000554017,0.000554017,0.137425165,0.026842431,0.602512726,0.773094377,0.247991213,4.91E-06,0.722794724,0.864860644,obscene,0.014285714
39418,midland,lost in the night,2019,country,california sunset walk cigarette remember dance holiday finger belt loop lips skin shoot star satellite shinin lose night darling right hold tight baby come whisper goodbye lose night little turn radio hear song play laugh word wrong bribe hold lose night darling right hold tight baby come whisper goodbye lose night heart beat time lose night darling hold tight baby come whisper goodbye lose night,65,0.103267377,0.067084706,0.000923361,0.146182737,0.000923361,0.018571309,0.351833954,0.000923361,0.000923361,0.107960954,0.000923361,0.093117053,0.000923361,0.000923361,0.000923361,0.000923361,0.585183581,0.774248135,0.074798268,2.58E-06,0.580585326,0.769762579,romantic,0.014285714
39422,midland,every song’s a drinkin’ song,2019,country,song drinkin song drinkin fast slow good buzz wanna raise glass cause song drinkin song drinkin lovers lovers brokenhearted brothers mothertruckers gettin high cowboys want jones bikers roll stone bartender say need fight cause song drinkin song drinkin fast slow good buzz cash trash cause song drinkin song drinkin jukebox choosy boozy quarter want grievance save need shut help sing cause song cause song drinkin song drinkin fast slow good buzz try raise hell cause song drinkin song drinkin come boys need drink double try right cause song drinkin song drinkin cline want wine cause song drinkin song drinkin,99,0.000785546,0.07024659,0.000785546,0.000785546,0.054982617,0.015212816,0.000785546,0.000785546,0.180272816,0.311291898,0.147858392,0.000785546,0.000785546,0.000785546,0.000785546,0.037191487,0.537528431,0.786913827,0.377509415,0,0.712489695,0.736728514,music,0.014285714
39434,jelly roll,same asshole,2019,country,forgive drink backroad think remember band play ship sink matter theres escape past keep chase know karma constant hearts break know forgive shit bother soul throw face shit fuck matter feel judge mistake good outweigh million hate single fuck thing good outweigh million hate single fuck thing think hard time hard past thank change somedays asshole backroad couple cross road sing song admit infatuate clown guess help better understand entertain expense pain dance rain instead complain brother say ahead game fuck money jealousy come line regret shit admit bless lessons life marathon tighten cause gotta know dollar spend fast dollar come dudes strip club ones try crib start kid college fund forreal think hard time hard past thank change somedays asshole backroad couple cross road sing songs real minute release passion gettin bigger need lookin like fuck happen babymama jail relapse swear tellin truth shit father leukemia leave critical care mention mama dementia feel sick help rent unhappy get complain daughter doin great plus musicshit dream fuck think mistake baby road headin home think hard time hard past thank change somedays asshole backroad couple cross road sing songs,188,0.01026289,0.000386997,0.307550924,0.000386997,0.000386997,0.036988304,0.000386997,0.130840769,0.34343967,0.071426604,0.035914281,0.000386997,0.015202511,0.000386997,0.000386997,0.025963451,0.69349074,0.735071661,0.01315162,0,0.457955482,0.741733676,obscene,0.014285714
39444,mitch rossell,ask me how i know,2019,country,stubborn come settle stick rule ways gotta freedom gotta space meet girl swear start feel things felt spend time try figure hold start fall hold pride start build wall inside push away cause know leave know shake head tell wrong fool song know cause know meet girl swear start feel things felt spend time try figure hold start fall hold pride start build wall inside push away cause know leave know best song repeat maybe like meet girl swear start feel things felt spend time try figure hold start fall hold pride start build wall inside push away cause know leave know,102,0.000515996,0.073995898,0.000515996,0.03826925,0.000515996,0.000515996,0.060869639,0.319697389,0.000515996,0.022889433,0.000515996,0.000515996,0.032233683,0.052576916,0.371649664,0.000515996,0.505036283,0.742301874,0.171685915,2.52E-06,0.204451772,0.580567481,sadness,0.014285714
39446,tucker beathard,better than me,2019,country,kale coastline chill glass wine california dream soak hopefully better mississippi moon ladder alabama shin baby hood shady yeah hopefully better yeah better sing play song tear eye break cry road move sleep baby better believe better believe better better tear get close hold hand yeah hopefully treat better yeah treat better sing play song tear eye break cry road move sleep baby better believe better believe better better sing play song tear eye break cry road move yeah sleep better believe better believe better better yeah better believe better believe better better yeah better better yeah better,98,0.055404248,0.000604961,0.128634542,0.000604961,0.095402029,0.000604961,0.000604961,0.000604961,0.32274831,0.090885178,0.058536824,0.066288542,0.000604961,0.000604961,0.157312974,0.000604961,0.515866999,0.833166679,0.047790209,3.21E-05,0.429101401,0.879876128,obscene,0.014285714
39448,chris stapleton,the ballad of the lonesome cowboy,2019,country,lonesome cowboy lonesome come change life fix break lonesome cowboy friend friends comin ears lonesome tell wrong wrong take shelf play wonderful wonderful lonesome cowboy anymore felt lonesome cowboy anymore,30,0.002392345,0.002392345,0.087730598,0.002392345,0.002392344,0.002392345,0.002392345,0.387183167,0.060205631,0.367610923,0.002392345,0.002392345,0.002392345,0.002392345,0.063776858,0.002392345,0.656666306,0.689664898,0.288151896,7.73E-05,0.126133553,0.538524126,music,0.014285714
39452,whiskey myers,bury my bones,2019,country,young write mother tell soul go home vessel anderson county drive real slow long home tell pick shovel wrestle sugar sand bury bone bury bone beneath pin come time bury bone throw funeral sister fiddle brother pass shine deep holler pick tallest pine real deep root touch cross river open wide heroine sail choctaw follow trail silver stone gather body bury bone bury bone yeah young write mother tell soul go home anderson county drive real slow long home tell pick shovel wrestle sugar sand bury bone bury bone beneath pin come time yeah young yeah young yeah young,99,0.000666223,0.339222423,0.000666223,0.046927867,0.05357446,0.025913262,0.000666223,0.000666223,0.000666223,0.080408373,0.07215989,0.062660381,0.109623915,0.000666223,0.000666223,0.058962763,0.520199285,0.782734661,0.001193776,1.55E-05,0.516694147,0.65964903,violence,0.014285714
39459,kane brown,american bad dream,2019,country,remember ninth grade gettin lay skippin class tryin catch gotta test bullet proof vest scar death shoot like close eye everybody start fallin devil disguise hide line hide truth american dream mess reality becomin numb tragedy somebody american dream american dream remember goin limit ticket inconvenience gettin stop cop play jury good ones worry showin doin like close eye everybody start fallin devil disguise hide line hide truth american dream mess reality becomin numb tragedy somebody american dream yeah american dream american dream like close eye everybody start fallin devil disguise damn american dream mess reality becomin numb tragedy somebody american dream american dream american dream american dream,108,0.000809717,0.305687677,0.049314443,0.000809717,0.052555973,0.000809717,0.000809717,0.000809717,0.269617949,0.000809717,0.000809717,0.065333869,0.000809717,0.000809717,0.000809717,0.064984037,0.560272934,0.773273851,0.030119508,1.65E-06,0.603256389,0.771764644,violence,0.014285714
39462,christie huff,black and white,2019,country,time game fight hurt tear stay straight core room second place home rise rise versus beast rise strong survive rise time weak time rise break dust come reach deep break grind beat brush come come time settle score blood fight break talk trash step plate rise refuse rise ash dust rise remember rise trust,54,0.001144165,0.425121219,0.061969184,0.108536282,0.001144165,0.001144165,0.001144165,0.001144165,0.001144165,0.026505529,0.001144165,0.202644617,0.001144165,0.001144165,0.160349027,0.001144165,0.604678869,0.694023537,0.627509666,1.18E-06,0.047506183,0.421403351,violence,0.014285714
39469,jordan rager,small town talkin',2019,country,give want follow give feel small head know stumble fall learn start crawl give sorry couldn follow give swallow pride say goodbye give sorry couldn follow oohoh give give thank guy time paris huge,34,0.001814882,0.16186321,0.41044944,0.001814882,0.001814882,0.001814882,0.039115297,0.256353355,0.001814882,0.001814882,0.001814882,0.001814882,0.001814882,0.001814882,0.083890471,0.001814882,0.546193003,0.824603236,0.000634539,0,0.434253916,0.815810063,world/life,0.014285714
39470,adam doleac,solo,2019,country,warm return melt away snow free chain winter let stand ocean hear wave call tide sail fate guide ship ax spear swords guide storm whip brutal ship await shore time come leave country family home riches east return bring fate write weave norns sacrifice longship sail strong breeze start blow carry fame pride glorious sword hand guide ship ax spear swords guide storm whip brutal guide ship ax spear swords guide storm whip brutal,74,0.001385042,0.120316994,0.001385042,0.021462603,0.001385042,0.001385042,0.001385042,0.001385042,0.001385042,0.305392641,0.040340448,0.001385042,0.136789867,0.001385042,0.087582476,0.001385042,0.590598939,0.748224496,0.006555227,0,0.748557296,0.697688256,music,0.014285714
39485,tracy lawrence,just the south comin' out,2019,country,rasin bite chew oblige yeah reckon phrase like fixin partial allman brothers sawmill gravy spanish people backward guess talk change nothin mighty fine pretty mama pass black eye peas hear roll mouth south comin think roll bear memphis like fry restin dixon line real hurry like nice slow pardon howdy hello change nothin mighty fine pretty mama pass black eye peas hear roll mouth south comin point tryin hold matter bring piece change nothin mighty fine pretty mama pass black eye peas hear roll mouth south comin yeah south comin,90,0.000762777,0.155219776,0.062154744,0.000762777,0.030918428,0.047224989,0.000762777,0.000762777,0.31606752,0.000762777,0.000762777,0.000762777,0.146380772,0.167615539,0.000762777,0.000762777,0.500703997,0.84398636,0.065159704,0,0.754740313,0.951950451,obscene,0.014285714
39486,tracy lawrence,chicken wire,2019,country,guy cram dig change seat slugitout roadhouse look miss chicken wire bottle break fenders beer drip amplifiers howl scream playin finger bleed payin dues time chicken wire runnin high life hungry playin like need money cause ball gettin blackball motel pretty girls pass phone number chicken wire bottle break fenders beer drip amplifiers howl scream playin finger bleed payin dues time chicken wire pink underwear fold chair ball cigarettes dead presidents see throw chicken wire bottle break fenders beer drip amplifiers howl scream playin finger bleed payin dues time chicken wire stitch handcuff boys blue duct tape mama prayers attitude sleep park waffle house baby catch time chicken wire salt shakers money makers throw chicken wire,116,0.019164202,0.193097182,0.000892061,0.059437177,0.000892061,0.018707178,0.000892061,0.000892061,0.397214221,0.000892061,0.300783251,0.000892061,0.000892061,0.000892061,0.000892061,0.000892061,0.566771364,0.863728431,0.051806277,0,0.783594394,0.928926709,obscene,0.014285714
39491,tracy lawrence,running out of people to blame,2019,country,gonna look mirror sudden things gonna clearer trail destruction leave place hide late life pass runnin time runnin answer burnin road second chance ways wind blow hellbent bind roll everybody pray someday change run people blame walk shoe yeah live advice gonna know feel prove cost loose runnin time runnin answer burnin road second chance ways wind blow hellbent bind roll everybody pray someday change run people blame selfish little game runnin time runnin answer burnin road second chance ways wind blow hellbent bind roll everybody pray someday change run people blame,92,0.000683527,0.000683527,0.372305688,0.000683527,0.051563041,0.034009984,0.000683527,0.000683527,0.000683527,0.000683527,0.072146293,0.000683527,0.03595376,0.000683527,0.114677195,0.000683527,0.727065959,0.785580596,0.247991213,1.93E-06,0.53215169,0.788782192,world/life,0.014285714
39493,tracy lawrence,made in america,2019,country,assembly line makin detroit steel asphalt streets row field love handout somebody get luck friday night light fourth goal touchdown walk hearin roar crowd little deeper goin tough america heart pride star strip white blue stand grind back give america come hard work hand back break root deep state come freedom bear single heart pride star strip white blue stand grind back give america die star strip white blue stand grind back give america america america,76,0.001052632,0.390279283,0.001052632,0.001052632,0.001052632,0.082712518,0.029072353,0.001052632,0.047729542,0.074616625,0.001052632,0.157432597,0.036470391,0.001052632,0.133285317,0.037875058,0.610094227,0.806527703,0.019276124,0,0.482687552,0.848844128,violence,0.014285714
39497,cold creek county,drinkin',2019,country,step outside mornin felt hook garden hose spray lawn chair blow kiddie pool kick tan shoe water goin higher hell yeah lookin like beer weather time break cooler wrong cold hand lookin world raybans nothin better beer weather gonna friends grill crank speakers speaker deck kick chill cover charge clear beer weather time break cooler wrong cold hand lookin world raybans nothin better beer weather tell beer weather draw party crowd like beer weather drinkin beer weather time break cooler wrong cold hand lookin world raybans nothin better beer weather beer weather nothin better beer weather beer weather beer weather,100,0.000666223,0.000666223,0.06428862,0.066249525,0.013363213,0.000666223,0.000666223,0.000666223,0.321842396,0.000666223,0.379895133,0.025563295,0.000666223,0.000666223,0.000666223,0.000666223,0.631755659,0.741840371,0.122489079,1.66E-06,0.768136851,0.793787354,obscene,0.014285714
39498,uncle kracker,hey hey hey,2019,country,lately livin feelin unforgiven feel like gettin wrong trouble lately double somethin bust bubble keep barely floatin days gonna sittin round countin raindrops shin face everythin okay fact yeah time stay cloud part party start brokenhearted tell buyin place round days baby feel luck start change shin face everythin okay fact yeah time stay shin face days baby feel luck start change shin face everythin okay fact yeah time stay shin face everythin okay fact yeah time stay,78,0.037738654,0.000835422,0.146526116,0.118019757,0.072208751,0.000835422,0.000835422,0.000835422,0.35533627,0.000835422,0.000835422,0.153287548,0.012770265,0.000835422,0.000835422,0.078575591,0.514783927,0.821090685,0.000810242,0,0.686727123,0.868864773,obscene,0.014285714
39499,thomas rhett,don’t threaten me with a good time,2019,country,hankerin doin somethin crazy tell girl yeah know wednesday lookin good feel like friday night rip tshirt make want worst pretend like birthday dive right girl tequila fine fine say know party threaten good time counter stand watch loose pour little liquor live room twirl watch night baby know party threaten good time girl know better think oneup match shoot shoot ugly forget college friday nights baby know party threaten good time counter stand watch loose pour little liquor live room twirl watch night baby know party threaten good time baby watchin dancin watchin lovin baby gettin start yeah baby asleep mornin counter stand watch loose pour little liquor live room twirl watch night baby know party threaten good time baby know party threaten good time,126,0.121208906,0.00055991,0.049506912,0.157911484,0.022964772,0.04395627,0.00055991,0.126269398,0.324779701,0.00055991,0.00055991,0.00055991,0.00055991,0.066049897,0.00055991,0.081753556,0.643669447,0.794733738,0.000655623,0,0.728977741,0.810804902,obscene,0.014285714
