,artist_name,track_name,release_date,genre,lyrics,len,dating,violence,world/life,night/time,shake the audience,family/gospel,romantic,communication,obscene,music,movement/places,light/visual perceptions,family/spiritual,like/girls,sadness,feelings,danceability,loudness,acousticness,instrumentalness,valence,energy,topic,age
38727,parmalee,hotdamalama,2017,country,delta donk drop hammer talk knock country grammar south amen dial hotter summer tent revival alabama sweet home sweet home turn ought keep back yeah yeah girl like class high dollar ticket chattanooga choochoo woowoo woowoo yeah kick like rocket cutoffs cling pocket talk bout home grand slamalamalama picture perfect panorama super fine reason rhyme hotdamalama uhhuh like snapshot paparazzi camera break nuffs come runner panama city tshirt miss banana boat boat motorboat handful juggle emotions yeah yeah girl like class high dollar ticket chattanooga choochoo woowoo woowoo yeah kick like rocket cutoffs cling pocket talk bout home grand slamalamalama picture perfect panorama super fine reason rhyme hotdamalama motorboat woowoo yeah yeah girl like class high dollar ticket chattanooga choochoo woowoo woowoo yeah kick like rocket cutoffs cling pocket talk bout home grand slamalamalama picture perfect panorama super fine super finefine super fine reason rhyme hotdamalama hotdamalama,147,0.000720981,0.000720981,0.000720981,0.000720981,0.15639781,0.000720981,0.000720981,0.000720981,0.314131119,0.111998409,0.159399462,0.000720981,0.000720981,0.247979472,0.000720981,0.000720981,0.561356006,0.815116786,0.011946799,0,0.812448475,0.923921548,obscene,0.042857143
38738,nashville cast,sanctuary,2017,country,turn light tell time rest close eye best sanctuary safe place fall away worry refuge time shelter rain share weight sanctuary weather storm take comfort arm dark cloud come lift sanctuary safe place fall away worry refuge time shelter rain share weight sanctuary share weight sanctuary,46,0.001594896,0.001594896,0.258673576,0.001594897,0.001594896,0.073454746,0.001594896,0.001594897,0.001594896,0.001594896,0.001594896,0.256633257,0.001594896,0.001594896,0.336396693,0.001594896,0.30575111,0.66279517,0.672690434,0,0.131286068,0.263240253,sadness,0.042857143
38739,brantley gilbert,smokin' gun,2017,country,cell phone ringin yeah sound like sippin somethin hear baby yeah bout subtle freight train comin know knockin door standin dress waitin pull trigger point blank kiss close better miss heart beatin like bullet chest bite wreckin see go mornin come like hold baby smokin yeah think like montana callin shots like world hook turn table comin little smile face beggin play sayin game guessin game pull trigger point blank kiss close better miss heart beat like bullet chest bitin wreckin see go mornin come like hold baby smokin like fortyfour bullet dangerous game help spin knowin go late cock pull trigger point blank kiss close better miss heart beatin like bullet chest bitin wreckin see go mornin come like hold baby smokin yeah pull trigger,126,0.086695388,0.000611995,0.000611995,0.000611995,0.048545545,0.042109125,0.136597033,0.000611995,0.459212947,0.000611995,0.000611995,0.000611995,0.000611995,0.128451386,0.000611995,0.074934961,0.512617784,0.767223034,0.067669747,9.27E-06,0.486809563,0.825820386,obscene,0.042857143
38751,logan mize,life's a party,2017,country,sixteen grow show yeager bomb blow throw july tangle spangle girl wrangle right right stone cold radio song good time good friends crank long week end world life party booty twang jeeprack stack black world life party bottle rocket saturday night state road run break headlight feelin effin better heaven world life party haybale hangin twin bangin singin bout hoocheecoochee drinkin thinkin bout shoot arrow right world life party booty twang jeeprack stack black world life party bottle rocket saturday night state road run break headlight feelin effin better heaven world life party right right stone cold radio song good time good friends crank long week end world life party booty twang jeeprack stack black world life party bottle rocket saturday night state road run break headlight feelin effin better heaven world life party life party life party life party,140,0.000526316,0.081568909,0.295463966,0.103584156,0.000526316,0.000526316,0.000526316,0.000526316,0.320420219,0.043410465,0.063370279,0.000526316,0.000526316,0.011256567,0.000526316,0.041483255,0.600346583,0.800579443,0.006324304,0,0.644476505,0.800794579,obscene,0.042857143
38752,kacey musgraves,the wurlitzer prize,2017,country,hello friend long play outside pour rain road start live dream mind ache lord stop happen live life drop road wear shoe talk good things sing blue go stay know matter time live dream mind ache lord stop happen live life drop waste time alive today churn past easier time mean good walk friend live dream mind stop ache happen live life drop happen live life drop happen live life drop,71,0.000785546,0.000785546,0.414499371,0.078469433,0.000785546,0.031205938,0.000785546,0.107572472,0.000785546,0.047098578,0.076323602,0.000785546,0.016069937,0.000785546,0.000785546,0.038289418,0.447633489,0.659641566,0.608433342,0,0.277617477,0.355335222,world/life,0.042857143
38759,seckond chaynce,i miss you bae,2017,country,beautiful like beautiful gag maybe real maybe phantom expect vanish expect happen think last power give heart sadly chapter come bitter talk friends fervently freeze know baby know wanna tough anymore gonna swallow pride confess need time mature say move grownup thing ignore hearts sore go miss miss go outta mind cause miss miss miss miss baby miss miss baby miss baby baby hide homies right person fool time forget question like wanna tough anymore explode gotta know feel wanna tough anymore gotta swallow pride spit know go miss miss go outta mind cause miss miss miss miss baby miss miss miss baby baby miss go miss miss go outta mind cause miss miss,114,0.111403636,0.00055991,0.00055991,0.030976441,0.00055991,0.00055991,0.00055991,0.255932756,0.058455601,0.00055991,0.00055991,0.00055991,0.00055991,0.036774203,0.057012883,0.331453115,0.722733673,0.699869241,0.385541552,0,0.672300082,0.467450835,feelings,0.042857143
38760,brantley gilbert,bro code,2017,country,look atcha girl standin doorway rockin curl cutoff daisies call come bore death drink lonely get stone home know code breakin situation better girl home better home better tell need cause bout long go open door get talkin talkin bout controllin tryin hold gettin ready roll want tell cause drink lonely get stone home know code breakin situation better girl home better home better tell need cause bout long go better girl good time goodbye grant hand matter time matter time know business gotta insist somebody deal finish code go window lettin know cause drink lonely get stone home know code breakin situation better girl home better home better tell need cause bout long go better girl good time goodbye grant hand matter time matter time,126,0.000510986,0.016618635,0.000510986,0.103971932,0.000510986,0.000510986,0.046931316,0.172790811,0.344098487,0.134075867,0.000510986,0.000510986,0.000510986,0.074332461,0.000510986,0.062990383,0.514783927,0.783452555,0.011243987,2.02E-05,0.791838417,0.92492258,obscene,0.042857143
38763,brantley gilbert,the devil don't sleep,2017,country,lord know devil sleep shut eye hear creepin yeah battle scar heart lord know gettin start think beat shoulder whisperin lyin tell leave turn brother lord know devil sleep shut eye hear creepin heaven know hell bend shackle chain thank break free cause lord know devil sleep door steal kill leave desperate prayer pray save soul like thousand time lord know devil sleep shut eye hear creepin heaven know hell bend shackle chain thank break free cause lord know devil sleep devil sleep lord know devil sleep shut eye hear creepin heaven know hell bend shackle chain thank break free lord know devil sleep shut eye hear creepin heaven know hell bend shackle chain thank break free cause lord know devil sleep devil sleep devil sleep yeah,127,0.000461681,0.495355544,0.000461681,0.000461681,0.020004934,0.134474734,0.000461681,0.18392523,0.016178465,0.000461681,0.000461681,0.000461681,0.091278752,0.000461681,0.053242175,0.000461681,0.505036283,0.776888957,0.002760043,0.000104251,0.37860676,0.763756386,violence,0.042857143
38764,jason isbell and the 400 unit,chaos and clothes,2017,country,grind dark take take heart wrap round tree like lovers leave chaos clothe quiet corner rarely proof real despite struggle forget fight death friend black metal tshirts shield past breath friend monsters kill monsters kill choose place turn collar better frame face hate hate somebody know leave trail crumb know realize garden grow fight death friend airwaves grand battlefield past breath friend monsters kill monsters kill sleep build machine want hear dream night burn ferris wheel mean anybody guess lovers leave chaos clothe debris sort hell ghost mess fight death friend fight like chain wheel past breath friend monsters kill monsters kill,102,0.000692521,0.487425584,0.000692521,0.000692521,0.000692521,0.000692521,0.066648137,0.209799696,0.000692521,0.000692521,0.162085842,0.000692521,0.021364667,0.000692521,0.000692521,0.022658093,0.539694574,0.5194985,0.787148381,0,0.266281946,0.20417935,violence,0.042857143
38765,turnpike troubadours,the winding stair mountain blues,2017,country,turn shut eye gravel look clear driveway cloud dust chrome rust beggin scatter highway forget raise hell county wish shelter wind hurricane come curse fiddle till break bind curse locomotive rail trouble look easy find devil fine nearly take lead pistol speed shoot kill plan forgive deer kill truth tell barely live curse fiddle till break bind curse locomotive rail trouble look easy find devil fine wind stair think trick plan fight lantern light go go sheriff come night alright help fall say shoot gonna live curse fiddle till break bind curse locomotive rail trouble look easy find devil fine devil fine,102,0.000785546,0.363794591,0.09331515,0.000785546,0.000785546,0.000785546,0.000785546,0.000785546,0.000785546,0.000785546,0.131868068,0.09207858,0.050826695,0.119269621,0.068367728,0.000785546,0.383732265,0.778273466,0.012750013,0.000356275,0.716611707,0.917915354,violence,0.042857143
38779,brett young,close enough,2017,country,close close close close mmmh like minutes see seat california feel like girl want cause close close touch go crazy everytime touch inch hearts beat cause close close oooh oooh know know begin wrap mind rain world eye want kiss close hold till open cause close close touch go crazy everytime touch inch hearts beat cause close close oooh come kiss babe oooh come lean need skin skin close close touch go crazy everytime touch inch hearts beat cause close close oooh ooooh close,84,0.049623283,0.00075188,0.00075188,0.00075188,0.00075188,0.00075188,0.418289173,0.074176026,0.00075188,0.00075188,0.00075188,0.154874038,0.00075188,0.09934801,0.00075188,0.058932078,0.484457923,0.777965798,0.003804221,1.62E-06,0.554822754,0.735727482,romantic,0.042857143
38781,seckond chaynce,undeniable,2017,country,undeniable undeniable breath takin amazin sure mistakin hatin waitin undeniable lock explode second chizzle gotta lock flow comin kickin rhythm givin onehundred percent time hotness knock guarantee nevernever stop flow thinkin better veteran lettermen surely chizzle topic folks roll finna city know feel body ready gold ticket bout time gotta grind gotta heart mind allspark rhyme cause like alien optimus prime star give tellin heaven scar stitch young life dealin ball break know hard livin course livin quittin look race usain bolt swift endure gift ready gonna thing say unreliable undeniable breath takin amazin sure mistakin hatin waitin undeniable breath takin amazin sure mistakin hatin waitin undeniable wanna world world wanna world undeniable wanna world world wanna world undeniable call things gorilla awesome expensive charge title give people tampa zealand screamin sizzle months gotta crush bust crush stuff microphone crush shit lyrical strike finna ready gonna thing say unreliable undeniable breath takin amazin sure mistakin hatin waitin undeniable breath takin amazin sure mistakin hatin waitin undeniable wanna world world wanna world undeniable wanna world world wanna world undeniable breath takin amazin sure mistakin hatin waitin undeniable breath takin amazin sure mistakin hatin waitin undeniable,194,0.000506073,0.070632975,0.253603605,0.000506073,0.000506073,0.000506073,0.000506073,0.071053964,0.400712806,0.000506073,0.000506073,0.000506073,0.000506073,0.000506073,0.019722713,0.000506073,0.643669447,0.736635643,0.167669847,0,0.915498763,0.738730579,obscene,0.042857143
38783,eli young band,never land,2017,country,word yeah wreck roll lips high good get bottle right right wanna feet cold hard floor kiss steal wanna steal right palm hand fall fall like land head heartbeat hit feel like gravity exist wanna stop know fall fall like land hang like dance stretch song long float like make memories night night wanna feet cold hard floor kiss steal wanna steal right palm hand fall fall like land head heartbeat hit feel like gravity exist wanna stop know fall fall like land fall like land stay get fly wanna feet cold hard floor kiss steal wanna steal right palm hand fall fall like land head heartbeat hit feel like gravity exist wanna stop know fall fall like land fall like land fall like land fall fall fall like land fall fall fall like land fall fall fall like land,140,0.000424448,0.000424448,0.000424448,0.055042303,0.009164811,0.000424448,0.033808553,0.000424448,0.000424448,0.009984511,0.116463885,0.055686083,0.096655077,0.181169475,0.338296384,0.000424448,0.538611502,0.788631644,0.006856433,5.35E-06,0.505358615,0.850846193,sadness,0.042857143
38784,midland,at least you cried,2017,country,word lips sound good right things like heart break know baby wish believe tear eye know mean cry sing okay fine hurt waste time know late appreciate try cry baby wish believe tear eye know mean cry sing mean say love game baby wish believe tear eye know mean cry baby wish believe tear eye know mean cry sing,59,0.07648556,0.000892061,0.000892061,0.057413801,0.000892061,0.000892061,0.040257908,0.345136159,0.000892061,0.075999967,0.000892061,0.000892061,0.000892061,0.000892061,0.375638267,0.018363611,0.51695007,0.786093377,0.011645594,0.00465587,0.694971146,0.865861677,sadness,0.042857143
38786,jelly roll,dearly departed,2017,country,dearly depart tshirt number go track havin flash back time give dime switch side come home different mind open chair dinner time hand lend show get grain shame cool flame listen feds clear view hard shit lose bein rude speakin truth rotten core gotta pull tooth fool drink juice shake cage loose monkey hang gorillas bananas fee baby baby proceed caution baby baby darkness baby baby heartless dearly depart dearly depart baby baby proceed caution baby baby darkness baby baby heartless dearly depart dearly depart money problems changin need fade black talkin talkin state facts knives wake pray pray pray get holdin snake hand blame snake pullin skeletons closet fuck end fightin monster fuck house haunt believe confidential informant pray ones tryna give life raft tryna drown go circus ones tryna clown vultures talk mondo dream say fuck worse nothin streets bruh somethin home talk mondo dream say fuck worse nothin streets bruh somethin somethin baby baby proceed caution baby baby darkness baby baby heartless dearly depart dearly depart baby baby proceed caution baby baby darkness baby baby heartless dearly depart dearly depart baby baby baby baby baby baby dearly depart dearly depart,193,0.310557107,0.108467407,0.138547181,0.000461681,0.000461681,0.000461681,0.000461681,0.000461681,0.318697286,0.000461681,0.068964795,0.048764377,0.000461681,0.000461681,0.000461681,0.000461681,0.80288097,0.743199241,0.089456917,0,0.52493817,0.653642836,obscene,0.042857143
38787,eli young band,skin & bones,2017,country,skin bone backroads home long story yeah goodbye imagine think plan know happen skin bone skin bone life wheel engine need spark yeah keep goin skin bone backroads home long story yeah goodbye imagine think plan know happen skin bone skin bone yeah fight like shoot whiskey forgiveness pill takin mornin smile kiss yeah sayin baby know skin bone backroads home long story goodbye imagine think plan know happen skin bone skin bone heart head hand drug runnin blood skin bone skin bone,83,0.017943015,0.431923541,0.000730994,0.022900627,0.083497224,0.028307848,0.093480958,0.180220852,0.04696305,0.041195879,0.046988058,0.000730994,0.000730994,0.000730994,0.000730994,0.000730994,0.450882703,0.723969951,0.109436857,0.00242915,0.423948887,0.724716127,violence,0.042857143
38788,midland,check cashin' country,2017,country,road heart texas drivin band playin country western drivin night try sure gettin rest highway lord telephone sayin tryin motor runnin sure money check cashin country check cashin country nights gettin long showin life country roll band lookin highway patrolman stick sound tire highway pull truck stop pour coffee lord know go sure money check cashin country check cashin country nawha hear jar jingle cause single radio dance tryin turn nickel solid country gold go texas tennessee cover place highways kind life sure money check cashin country check cashin country nawha hear jar jingle cause single radio dance tryin turn nickel solid country gold go texas tennessee cover place twostep sure money check cashin country check cashin country country country check cashin country,123,0.000578369,0.000578369,0.023420355,0.000578369,0.000578369,0.025403585,0.000578369,0.000578369,0.364017507,0.054690301,0.510954927,0.000578369,0.000578369,0.000578369,0.013994527,0.000578369,0.423805914,0.775376253,0.15963771,0,0.483718054,0.883880257,obscene,0.042857143
38794,lady antebellum,somebody else's heart,2017,country,think resistant position yeah road lead lovers friends park outside party know wish heart borrow tomorrow cause start tonight gonna kiss lips gonna hold arm throw shadow dark better judgement wish somebody heart somebody heart somebody heart wish feel fall grind wanna feel buzz get closer hangover round tonight gonna kiss lips gonna hold arm throw shadow dark better judgement wish somebody heart somebody heart somebody heart somebody heart wish heart borrow tomorrow tomorrow tonight gonna kiss lips gonna hold arm throw shadow dark better judgement wish somebody heart somebody heart somebody heart somebody heart somebody heart somebody heart,99,0.000584795,0.000584795,0.000584795,0.077879042,0.011901981,0.000584795,0.161586665,0.000584795,0.054004914,0.000584795,0.036403208,0.000584795,0.000584795,0.000584795,0.392401713,0.171307979,0.633921802,0.737943235,0.364457193,3.92E-05,0.406430338,0.723715095,sadness,0.042857143
38802,shania twain,life's about to get good,2017,country,wasn break shatter trust matter longer sing like couldn think flatter life life pain forgive walk away ready love life life good life good life good life good longer tear fell wider river kill life believe things better time forget forever life life pain forgive walk away ready love life life good life good life good life good life good life good life good take long strong alive hold feel hurt heal lie good good getahhh life life pain forgive walk away ready love life life good life good life good life good life good life good life good life life pain life life good,105,0.000515996,0.014086379,0.486779387,0.039088112,0.000515996,0.000515996,0.036847015,0.000515996,0.000515996,0.010649159,0.000515996,0.000515996,0.000515996,0.000515996,0.164989625,0.231435446,0.623091086,0.792964644,0.006324304,0,0.653751031,0.895892644,world/life,0.042857143
38806,chris stapleton,broken halos,2017,country,see share break halos fold wing go break halos shine angels come heavens help come teach leave soul save see share break halos fold wing go break halos shine break halos shine look reason ask mean know answer belong belong see share break halos fold wing go break halos shine break halos shine break halos shine break halos shine,59,0.001144165,0.001144165,0.212948531,0.001144165,0.001144165,0.001144165,0.001144165,0.001144165,0.001144165,0.001144165,0.001144165,0.33835295,0.001144165,0.001144165,0.381418982,0.050117065,0.594931225,0.732764146,0.119477028,3.97E-06,0.47856554,0.572559223,sadness,0.042857143
38809,raelynn,lonely call,2017,country,monday thrift shop couch bowl cheerios get dark click remote episode crazy housewives know face screen ringtone mean friends go thinkin bout good morning beautiful land miss stand weekend midnight number familiar voice start wonder wrong choice ring ring night long cause lonely weeks days hours count thousand tear feel like year look peace cause say break seat jeep leave message beep good morning beautiful land miss stand weekend midnight number familiar voice start wonder wrong choice ring ring night long cause lonely lonely ring ring ring girl ring ring ring girl ring ring ring girl ring ring ring girl ring ring ring girl ring good morning beautiful land miss stand weekend midnight number familiar voice start wonder wrong choice ring ring night long cause lonely lonely lonely yeah yeah yeah,131,0.000487329,0.000487329,0.000487329,0.055894795,0.030626092,0.000487329,0.000487329,0.065529978,0.053734606,0.356193361,0.000487329,0.053966991,0.066374779,0.12242525,0.093519738,0.097348444,0.570020578,0.794554265,0.066565328,0,0.226092333,0.722714063,music,0.042857143
38811,tim mcgraw,the rest of our life,2017,country,sit dark room warm fireplace know brighten past right hand plan rest life thing give give worryin life fine hair show fine waistline grow fine time take toll stay young rest live make plan children look eye name pick daughter thing give give worry life fine hair show fine waistline grow fine time take toll stay young rest live care cloud brew long young young young fine hair show fine waistline grow fine time take toll stay young rest life stay young rest life stay young rest life,88,0.000674764,0.000674764,0.441734059,0.180227144,0.000674764,0.000674764,0.000674764,0.000674764,0.000674764,0.000674764,0.056805446,0.057327727,0.126983143,0.12815055,0.000674764,0.000674764,0.601429655,0.737097146,0.652610093,0,0.318837593,0.468451868,world/life,0.042857143
38817,walker hayes,shut up kenny,2017,country,gotta kid chesney time turn ignition radio shotgun vision thank like heart need help break department yeah take care offense shut leave songs gotta sound like felt stuff shit drive songs know like music hate hurt listen know need radio dash damn shut hell track hurt voice like mean time machine go backwards station need change want love hat shut leave songs gotta sound like felt stuff shit drive songs know like music hate hurt listen know need radio dash damn shut radio shotgun vision thank like heart need help break department,92,0.000674764,0.000674764,0.000674764,0.000674764,0.075380701,0.026847416,0.015389947,0.130698388,0.407722127,0.190844291,0.000674764,0.000674764,0.000674764,0.000674764,0.145019963,0.000674764,0.644752518,0.706612312,0.493975396,0,0.495053586,0.625613933,obscene,0.042857143
38818,maren morris,rich,2017,country,laaaaadida laaaaadida dollar time swear time pick call crisp go dollar time right head prada benz driveway yacht water vegas mandarin high roller gamble diddy drippin diamonds like wouldn drown ious promise real value cause little lie roll lips money fall shit laaaaadida laaaaadida dime time cross mind basically sit pile dim time heart feel cheap lottery pain curse turn dollar sign cause head prada benz driveway yacht water vegas mandarin high roller gamble diddy drippin diamonds like wouldn drown ious promise real value cause little lie roll lips money fall shit laaaaadida laaaaadida tell wouldn wanna head prada benz driveway yacht water vegas mandarin high roller gamble diddy drippin diamonds like wouldn drown ious promise real value cause little lie roll lips money fall shit laaaaadida laaaaadida laaaaadida laaaaadida,130,0.000701754,0.000701754,0.000701754,0.086612501,0.000701754,0.046695381,0.052895125,0.135783638,0.307426956,0.000701754,0.070168747,0.000701754,0.000701754,0.000701754,0.151756009,0.025634906,0.545109932,0.806809733,0.044677756,0,0.85366859,0.855851354,obscene,0.042857143
38828,thomas rhett,life changes,2017,country,wakin college dorm yeah life pretty normal lookin date spring formal wasn worry bout nothin majorin undecided notebook songs writin dream like sittin walmart shelf funny life change nuttin life change stop train know gonna happen plan hear laughin life change wouldn change world world wouldn change world world buy ring say lyric commercial,54,0.001283697,0.001283697,0.400385368,0.001283697,0.026615319,0.001283697,0.001283697,0.134296741,0.18454915,0.097067688,0.001283697,0.001283697,0.001283697,0.040151622,0.001283697,0.001283697,0.677244666,0.802169064,0.100400703,0,0.809356966,0.845841031,world/life,0.042857143
